{
  "agent": {
    "model": "synthetic-model-v1",
    "name": "synthetic-writing-agent",
    "run_id": "synthetic-run-001"
  },
  "artifact_type": "writing_output",
  "content_markdown": "## Синтетический тезис 🧭\n\nПроверяемый черновик опирается только на разрешённую цитату из корпуса.",
  "content_sha256": "b51866f5c9ac0153cb28956eb78e7480b603b3ecffc6b3b4990faec668e41f66",
  "created_at": "2026-07-12T12:05:00Z",
  "dossier_key": "research-synthetic-systems-research-9362f4f3cb43",
  "handoff_digest": "878383079e430e8bb9c304c308f946f25e4e991a94bc824b09fbce45432cc177",
  "handoff_id": "handoff-2cdf18f4e0b8aa5c",
  "includes_drafts": false,
  "output_kind": "draft",
  "package_digest": "7c3c25c6844a159c73835ff0b1e53d896c6e8f74f8bb863169189a951b512e01",
  "revision_id": "rev-20260712T120000Z-01234567",
  "schema_version": "1.0",
  "sections": [
    {
      "char_end": 97,
      "char_start": 0,
      "citation_ids": [
        "cit-f0e3daa787325ec9"
      ],
      "heading": "Синтетический тезис 🧭",
      "section_id": "section-synthetic-1",
      "unsupported_by_corpus": false,
      "unsupported_reason": null
    }
  ],
  "title": "Синтетический черновик",
  "visibility": "published_only"
}
