{
  "agent": {
    "model": "synthetic-model-v1",
    "name": "synthetic-writing-agent",
    "run_id": "synthetic-run-001"
  },
  "artifact_type": "writing_output",
  "content_markdown": "## Краткое резюме 🧭\n\nСинтетическое резюме сохраняет проверяемую связь с исходным свидетельством.",
  "content_sha256": "63fc20431ee8f2fbcab6d6dbb37f54094dddc964beaa26998103300f2b517c40",
  "created_at": "2026-07-12T12:05:00Z",
  "dossier_key": "research-synthetic-systems-research-9362f4f3cb43",
  "handoff_digest": "dd613dbf11953fa6921bafc42275b8355996ee03d7a8d51fa4ba77386dfd13f7",
  "handoff_id": "handoff-164e8c92f4e463c1",
  "includes_drafts": false,
  "output_kind": "summary",
  "package_digest": "6ce077ec0f770b787930305885c2e07fed1a83c1eefc33f78b846790afee9bd6",
  "revision_id": "rev-20260712T120000Z-01234567",
  "schema_version": "1.0",
  "sections": [
    {
      "char_end": 96,
      "char_start": 0,
      "citation_ids": [
        "cit-f0e3daa787325ec9"
      ],
      "heading": "Краткое резюме 🧭",
      "section_id": "section-synthetic-1",
      "unsupported_by_corpus": false,
      "unsupported_reason": null
    }
  ],
  "title": "Синтетическое резюме",
  "visibility": "published_only"
}
